{
  "schema_version": 1,
  "id": "aldi-lidl",
  "name": "Aldi vs Lidl",
  "updated_at": "2026-10-23T04:10:03Z",
  "health": "ok",
  "service": {
    "kind": "cron",
    "name": "arfigyelo",
    "state": "unknown"
  },
  "last_ok_at": "2026-10-22T18:31:57Z",
  "last_error": null,
  "ok_last_24h": 1.0,
  "activity": {
    "kind": "run",
    "ok_24h": 2,
    "fail_24h": 0,
    "ok_ever": 24,
    "fail_ever": 0
  },
  "disk": {
    "total_mb": 190.1,
    "data_mb": 112.8,
    "project_mb": 0,
    "sqlite_mb": 0,
    "raw_mb": 0
  },
  "notes": {
    "source": "GVH Árfigyelő",
    "chains": 2,
    "observed_on": "2026-10-21",
    "n_products": 1365,
    "n_obs": 10901,
    "last_ingest_status": "success"
  }
}
