{
  "schema_version": 1,
  "id": "flights",
  "name": "Repjegy",
  "updated_at": "2026-10-23T10:10:03Z",
  "health": "unknown",
  "service": {
    "kind": "cron",
    "name": "farewatch",
    "state": "unknown"
  },
  "last_ok_at": null,
  "last_error": null,
  "ok_last_24h": null,
  "activity": {
    "kind": "run",
    "ok_24h": 0,
    "fail_24h": 0,
    "ok_ever": 0,
    "fail_ever": 0
  },
  "disk": {
    "total_mb": 0,
    "data_mb": 0,
    "project_mb": 0,
    "sqlite_mb": 0,
    "raw_mb": 0
  },
  "notes": {
    "phase": "planned",
    "route": "BUD–MAD"
  }
}
